[
  {"id":"omni-kb-001","title":"Store 状态类型漂移","pattern":"Store.*(?:type mismatch|类型不一致|type drift|set type mismatch)","flags":"i","trigger":"Store.set 写入的值类型和初始状态类型不一致。","intent":"保持状态结构稳定，避免同步和派生状态出现难以复现的状态错误。","solution":"保持状态类型稳定；如果确实要迁移类型，先新增字段或在 migration/emergencyPatch 中显式转换。","example":"store.set('hp', Number(nextHp));","docs":"docs/DX.md#store-state-type-drift","severity":"warn","source":{"type":"seed","issue":"seed-001","repo":"omnicore/local"}},
  {"id":"omni-kb-002","title":"EventBus 递归事件循环","pattern":"Event Loop Detected|OMNICORE_EVENT_RECURSION|recursion depth","flags":"i","trigger":"事件处理器同步 emit 自己或形成 A -> B -> A 循环。","intent":"防止运行时死循环和帧预算被事件风暴耗尽。","solution":"把递归 emit 改为 queueEvent/processEventFrame，或拆成一次性状态变更。","example":"events.queueEvent('ready', payload); events.processEventFrame();","docs":"docs/DX.md#eventbus-recursion","severity":"error","source":{"type":"seed","issue":"seed-002","repo":"omnicore/local"}},
  {"id":"omni-kb-003","title":"ECS 组件未注册","pattern":"组件尚未注册|component.*not.*registered|Component storage .* exceeded","flags":"i","trigger":"调用 addComponent/getComponent 前没有 registerComponent，或容量不足。","intent":"确保 ECS 数据列存在且容量可预测。","solution":"在创建实体前注册组件描述，并为高实体量场景设置 capacity。","example":"world.registerComponent({ name: 'Position', fields: { x: 'f32', y: 'f32' } });","docs":"docs/DX.md#ecs-component-registration","severity":"warn","source":{"type":"seed","issue":"seed-003","repo":"omnicore/local"}},
  {"id":"omni-kb-004","title":"资源路径 404","pattern":"404|failed to fetch|failed to load resource|资源路径","flags":"i","trigger":"Loader 或浏览器资源请求无法找到文件。","intent":"让资源路径、manifest 和本地服务器根目录保持一致。","solution":"检查 asset-manifest.json、public 根目录和大小写，避免直接用磁盘绝对路径。","example":"await loader.loadBundle([{ key: 'hero', url: '/assets/hero.png', type: 'image' }]);","docs":"docs/DX.md#asset-path-404","severity":"warn","source":{"type":"seed","issue":"seed-004","repo":"omnicore/local"}},
  {"id":"omni-kb-005","title":"对象未初始化","pattern":"Cannot read properties of undefined|undefined \\(reading|对象未初始化","flags":"i","trigger":"请确认 Scene 或 Entity 已创建，并在调用 add、set、render 等方法前完成初始化。","intent":"避免生命周期顺序错误导致空引用。","solution":"把访问移动到 init/create 之后，或在 safeInitialize 里集中初始化依赖。","example":"await game.init(); game.scene.push('boot');","docs":"docs/DX.md#object-not-initialized","severity":"error","source":{"type":"seed","issue":"seed-005","repo":"omnicore/local"}},
  {"id":"omni-kb-006","title":"Physics 后端未初始化","pattern":"attachBody 需要兼容 Matter\\.js|physics backend.*not initialized|setBackend","flags":"i","trigger":"创建刚体前没有安装或初始化物理后端。","intent":"确保碰撞逻辑在统一后端 API 上运行。","solution":"先调用 await physics.setBackend('matter', { module })，再创建刚体。","example":"await world.setBackend('matter', { module: Matter }); world.createRigidBody({ id: 'hero' });","docs":"docs/DX.md#physics-backend-init","severity":"warn","source":{"type":"seed","issue":"seed-006","repo":"omnicore/local"}},
  {"id":"omni-kb-007","title":"Renderer 后端切换未清理画布","pattern":"multiple canvas|renderer switch|WebGL context lost","flags":"i","trigger":"切换渲染后端后旧 canvas 或 WebGL 状态残留。","intent":"避免渲染上下文泄漏和重复输入命中。","solution":"使用 BackendManager.switch，让引擎清理容器 canvas 并重建 renderer。","example":"await game.backend.switch('canvas');","docs":"docs/DX.md#renderer-backend-switch","severity":"warn","source":{"type":"seed","issue":"seed-007","repo":"omnicore/local"}},
  {"id":"omni-kb-008","title":"派生状态循环依赖","pattern":"派生状态.*循环|derived.*cycle|dependency graph.*cycle","flags":"i","trigger":"Store.derive 之间形成闭环依赖。","intent":"保持派生状态为有向无环图。","solution":"把共享输入拆成普通状态字段，派生值只读基础字段。","example":"store.derive('total', ['score', 'bonus'], ({ score, bonus }) => score + bonus);","docs":"docs/DX.md#derived-state-cycle","severity":"error","source":{"type":"seed","issue":"seed-008","repo":"omnicore/local"}},
  {"id":"omni-kb-009","title":"WebAssembly 环境不可用","pattern":"WebAssembly\\.instantiate|当前环境不支持 WebAssembly|wasm.*missing","flags":"i","trigger":"非浏览器或 Worker 环境没有提供 WebAssembly.instantiate。","intent":"保证服务端结算在可执行 WASM 的环境中启动。","solution":"在 Node.js 18+、Cloudflare Workers 或兼容 WASI 主机运行；缺失时启用 JS fallback。","example":"const runtime = await createOmniCoreWasm({ path: 'dist/omnicore_core.wasm' });","docs":"docs/server-runtime-compatibility-report.md#wasm","severity":"error","source":{"type":"seed","issue":"seed-009","repo":"omnicore/local"}},
  {"id":"omni-kb-010","title":"Worker 不支持 instantiateStreaming","pattern":"instantiateStreaming|Cloudflare Workers.*wasm","flags":"i","trigger":"Cloudflare Workers 中使用 WebAssembly.instantiateStreaming 加载 wasm。","intent":"符合 Worker 模块环境的非流式 wasm 加载限制。","solution":"在模块顶层 import .wasm，再用 WebAssembly.instantiate(module)。","example":"const instance = await WebAssembly.instantiate(wasm);","docs":"docs/server-runtime-compatibility-report.md#cloudflare-workers","severity":"warn","source":{"type":"seed","issue":"seed-010","repo":"omnicore/local"}},
  {"id":"omni-kb-011","title":"模式 011：Issue 种子","pattern":"OMNI_KB_PATTERN_011","flags":"i","trigger":"本地 Issue 提取前的种子触发条件 011。","intent":"记录常见输入、状态、渲染、资源或构建错误模式。","solution":"参考对应错误消息修正调用顺序、资源路径或配置。","example":"node scripts/extract-knowledge-from-issues.js --repo owner/name","docs":"docs/DX.md#knowledge-base","severity":"info","source":{"type":"seed","issue":"seed-011","repo":"omnicore/local"}},
  {"id":"omni-kb-012","title":"模式 012：Issue 种子","pattern":"OMNI_KB_PATTERN_012","flags":"i","trigger":"本地 Issue 提取前的种子触发条件 012。","intent":"记录常见输入、状态、渲染、资源或构建错误模式。","solution":"参考对应错误消息修正调用顺序、资源路径或配置。","example":"node scripts/extract-knowledge-from-issues.js --repo owner/name","docs":"docs/DX.md#knowledge-base","severity":"info","source":{"type":"seed","issue":"seed-012","repo":"omnicore/local"}},
  {"id":"omni-kb-013","title":"模式 013：Issue 种子","pattern":"OMNI_KB_PATTERN_013","flags":"i","trigger":"本地 Issue 提取前的种子触发条件 013。","intent":"记录常见输入、状态、渲染、资源或构建错误模式。","solution":"参考对应错误消息修正调用顺序、资源路径或配置。","example":"node scripts/extract-knowledge-from-issues.js --repo owner/name","docs":"docs/DX.md#knowledge-base","severity":"info","source":{"type":"seed","issue":"seed-013","repo":"omnicore/local"}},
  {"id":"omni-kb-014","title":"模式 014：Issue 种子","pattern":"OMNI_KB_PATTERN_014","flags":"i","trigger":"本地 Issue 提取前的种子触发条件 014。","intent":"记录常见输入、状态、渲染、资源或构建错误模式。","solution":"参考对应错误消息修正调用顺序、资源路径或配置。","example":"node scripts/extract-knowledge-from-issues.js --repo owner/name","docs":"docs/DX.md#knowledge-base","severity":"info","source":{"type":"seed","issue":"seed-014","repo":"omnicore/local"}},
  {"id":"omni-kb-015","title":"模式 015：Issue 种子","pattern":"OMNI_KB_PATTERN_015","flags":"i","trigger":"本地 Issue 提取前的种子触发条件 015。","intent":"记录常见输入、状态、渲染、资源或构建错误模式。","solution":"参考对应错误消息修正调用顺序、资源路径或配置。","example":"node scripts/extract-knowledge-from-issues.js --repo owner/name","docs":"docs/DX.md#knowledge-base","severity":"info","source":{"type":"seed","issue":"seed-015","repo":"omnicore/local"}},
  {"id":"omni-kb-016","title":"模式 016：Issue 种子","pattern":"OMNI_KB_PATTERN_016","flags":"i","trigger":"本地 Issue 提取前的种子触发条件 016。","intent":"记录常见输入、状态、渲染、资源或构建错误模式。","solution":"参考对应错误消息修正调用顺序、资源路径或配置。","example":"node scripts/extract-knowledge-from-issues.js --repo owner/name","docs":"docs/DX.md#knowledge-base","severity":"info","source":{"type":"seed","issue":"seed-016","repo":"omnicore/local"}},
  {"id":"omni-kb-017","title":"模式 017：Issue 种子","pattern":"OMNI_KB_PATTERN_017","flags":"i","trigger":"本地 Issue 提取前的种子触发条件 017。","intent":"记录常见输入、状态、渲染、资源或构建错误模式。","solution":"参考对应错误消息修正调用顺序、资源路径或配置。","example":"node scripts/extract-knowledge-from-issues.js --repo owner/name","docs":"docs/DX.md#knowledge-base","severity":"info","source":{"type":"seed","issue":"seed-017","repo":"omnicore/local"}},
  {"id":"omni-kb-018","title":"模式 018：Issue 种子","pattern":"OMNI_KB_PATTERN_018","flags":"i","trigger":"本地 Issue 提取前的种子触发条件 018。","intent":"记录常见输入、状态、渲染、资源或构建错误模式。","solution":"参考对应错误消息修正调用顺序、资源路径或配置。","example":"node scripts/extract-knowledge-from-issues.js --repo owner/name","docs":"docs/DX.md#knowledge-base","severity":"info","source":{"type":"seed","issue":"seed-018","repo":"omnicore/local"}},
  {"id":"omni-kb-019","title":"模式 019：Issue 种子","pattern":"OMNI_KB_PATTERN_019","flags":"i","trigger":"本地 Issue 提取前的种子触发条件 019。","intent":"记录常见输入、状态、渲染、资源或构建错误模式。","solution":"参考对应错误消息修正调用顺序、资源路径或配置。","example":"node scripts/extract-knowledge-from-issues.js --repo owner/name","docs":"docs/DX.md#knowledge-base","severity":"info","source":{"type":"seed","issue":"seed-019","repo":"omnicore/local"}},
  {"id":"omni-kb-020","title":"模式 020：Issue 种子","pattern":"OMNI_KB_PATTERN_020","flags":"i","trigger":"本地 Issue 提取前的种子触发条件 020。","intent":"记录常见输入、状态、渲染、资源或构建错误模式。","solution":"参考对应错误消息修正调用顺序、资源路径或配置。","example":"node scripts/extract-knowledge-from-issues.js --repo owner/name","docs":"docs/DX.md#knowledge-base","severity":"info","source":{"type":"seed","issue":"seed-020","repo":"omnicore/local"}},
  {"id":"omni-kb-021","title":"模式 021：Issue 种子","pattern":"OMNI_KB_PATTERN_021","flags":"i","trigger":"本地 Issue 提取前的种子触发条件 021。","intent":"记录常见输入、状态、渲染、资源或构建错误模式。","solution":"参考对应错误消息修正调用顺序、资源路径或配置。","example":"node scripts/extract-knowledge-from-issues.js --repo owner/name","docs":"docs/DX.md#knowledge-base","severity":"info","source":{"type":"seed","issue":"seed-021","repo":"omnicore/local"}},
  {"id":"omni-kb-022","title":"模式 022：Issue 种子","pattern":"OMNI_KB_PATTERN_022","flags":"i","trigger":"本地 Issue 提取前的种子触发条件 022。","intent":"记录常见输入、状态、渲染、资源或构建错误模式。","solution":"参考对应错误消息修正调用顺序、资源路径或配置。","example":"node scripts/extract-knowledge-from-issues.js --repo owner/name","docs":"docs/DX.md#knowledge-base","severity":"info","source":{"type":"seed","issue":"seed-022","repo":"omnicore/local"}},